{
    "$schema": "http://json-schema.org/draft-07/schema#",
    "title": "Generated schema for Root",
    "type": "array",
    "items": {
      "type": "object",
      "properties": {
        "Images": {
          "type": "string"
        },
        "SubjectArea": {
          "type": "string"
        },
        "CourseName": {
          "type": "string"
        },
        "CourseDetails": {
          "type": "string"
        },
        "Level": {
          "type": "string"
        },
        "EntryRequirement": {
          "type": "string"
        },
        "FeesandFunding": {
          "type": "string"
        },
        "KeyFacts": {
          "type": "string"
        }
      },
      "required": [
        "Images",
        "SubjectArea",
        "CourseName",
        "CourseDetails",
        "Level",
        "EntryRequirement",
        "FeesandFunding",
        "KeyFacts"
      ]
    }
  }